{
  "schema_version": 1,
  "event_id": "6f1c2c4e-6b1a-4f2e-9b3d-1a2b3c4d5e6f",
  "system_id": "system-a",
  "module_id": "module-03",
  "game_id": "7a2d3d5f-7c2b-4a3f-8c4e-2b3c4d5e6f70",
  "round_id": "8b3e4e60-8d3c-4b4a-9d5f-3c4d5e6f7081",
  "target_index": 7,
  "module_position": {
    "x": -1,
    "y": 0
  },
  "module_rotation": 90,
  "local_sequence": 1842,
  "device": {
    "boot_id": "9c4f5f71-9e4d-4c5b-ae60-4d5e6f708192",
    "uptime_us": 1832456789,
    "event_us": 1832456712
  },
  "coordinator": {
    "recv_us": 1832459000,
    "elapsed_us": 4210556,
    "clock_offset_us": -312,
    "offset_uncertainty_us": 90
  },
  "amplitude": 2710,
  "threshold": 920,
  "noise_floor": 140,
  "neighbours": [
    {
      "target_index": 4,
      "amplitude": 410,
      "delta_us": 620
    }
  ],
  "target_state_before": "active",
  "classification": "valid_hit",
  "firmware_version": "0.1.0",
  "replay": false
}
