{
  "schema_version": 1,
  "event_id": "8b3e4e60-8d3c-4b4a-9d5f-3c4d5e6f7081",
  "system_id": "system-a",
  "module_id": "module-05",
  "target_index": 1,
  "local_sequence": 990,
  "device": {
    "boot_id": "9c4f5f71-9e4d-4c5b-ae60-4d5e6f708192",
    "uptime_us": 900000000,
    "event_us": 899999100
  },
  "amplitude": 3100,
  "threshold": 1000,
  "target_state_before": "active",
  "classification": "valid_hit",
  "firmware_version": "0.1.0",
  "replay": true
}
